{
  "$schema": "https://json-schema.org/draft/2020-12/schema",
  "$id": "https://gethatch.pet/schemas/lookdev-texture3d-v1",
  "title": "Hatch look development texture3d v1",
  "description": "Contract validity alone proves no executed shader or renderer capability.",
  "$defs": {
    "texture3d": {
      "type": "object",
      "additionalProperties": false,
      "properties": {
        "schema_version": {
          "const": 1
        },
        "id": {
          "type": "string",
          "pattern": "^[A-Za-z0-9][A-Za-z0-9._:-]{0,127}$(?![\\s\\S])"
        },
        "version": {
          "type": "string",
          "pattern": "^(0|[1-9][0-9]*)\\.(0|[1-9][0-9]*)\\.(0|[1-9][0-9]*)$(?![\\s\\S])"
        },
        "name": {
          "type": "string",
          "minLength": 1,
          "maxLength": 4096
        },
        "description": {
          "type": "string",
          "minLength": 1,
          "maxLength": 4096
        },
        "dependencies": {
          "type": "array",
          "items": {
            "$ref": "#/$defs/ResourceRef"
          },
          "minItems": 0,
          "maxItems": 256
        },
        "provenance": {
          "type": "object",
          "additionalProperties": false,
          "properties": {
            "origin": {
              "enum": [
                "import",
                "authored",
                "derived",
                "procedural-fixture"
              ]
            },
            "tool": {
              "type": "string",
              "minLength": 1,
              "maxLength": 4096
            },
            "created_at": {
              "type": "string",
              "pattern": "^\\d{4}-\\d\\d-\\d\\dT\\d\\d:\\d\\d:\\d\\dZ$"
            },
            "source_hashes": {
              "type": "array",
              "items": {
                "type": "string",
                "pattern": "^[0-9a-f]{64}$(?![\\s\\S])"
              },
              "minItems": 0,
              "maxItems": 1024
            },
            "attribution": {
              "type": "string",
              "minLength": 1,
              "maxLength": 4096
            },
            "license": {
              "type": "object",
              "additionalProperties": false,
              "properties": {
                "identifier": {
                  "type": "string",
                  "minLength": 1,
                  "maxLength": 4096
                },
                "source": {
                  "type": "string",
                  "minLength": 1,
                  "maxLength": 4096
                }
              },
              "required": [
                "identifier",
                "source"
              ]
            }
          },
          "required": [
            "origin",
            "tool",
            "created_at",
            "source_hashes",
            "attribution",
            "license"
          ]
        },
        "validation_status": {
          "enum": [
            "unvalidated",
            "structurally-valid",
            "rejected"
          ]
        },
        "tags": {
          "type": "array",
          "items": {
            "type": "string",
            "pattern": "^[A-Za-z0-9][A-Za-z0-9._:-]{0,127}$(?![\\s\\S])"
          },
          "minItems": 0,
          "maxItems": 64
        },
        "capabilities": {
          "type": "array",
          "items": {
            "type": "string",
            "pattern": "^[A-Za-z0-9][A-Za-z0-9._:-]{0,127}$(?![\\s\\S])"
          },
          "minItems": 0,
          "maxItems": 64
        },
        "kind": {
          "const": "texture3d"
        },
        "file": {
          "type": "object",
          "additionalProperties": false,
          "properties": {
            "path": {
              "type": "string",
              "minLength": 1,
              "maxLength": 4096
            },
            "sha256": {
              "type": "string",
              "pattern": "^[0-9a-f]{64}$(?![\\s\\S])"
            },
            "bytes": {
              "type": "integer",
              "minimum": 1,
              "maximum": 1073741824
            }
          },
          "required": [
            "path",
            "sha256",
            "bytes"
          ]
        },
        "role": {
          "enum": [
            "base-color",
            "emission",
            "normal",
            "metallic",
            "roughness",
            "occlusion",
            "height",
            "displacement",
            "opacity",
            "environment",
            "transmission",
            "thickness",
            "clearcoat",
            "clearcoat-roughness",
            "sheen-color",
            "sheen-roughness",
            "anisotropy",
            "iridescence"
          ]
        },
        "encoding": {
          "enum": [
            "srgb",
            "linear-srgb",
            "data"
          ]
        },
        "width": {
          "type": "integer",
          "minimum": 1,
          "maximum": 16384
        },
        "height": {
          "type": "integer",
          "minimum": 1,
          "maximum": 16384
        },
        "channels": {
          "type": "integer",
          "minimum": 1,
          "maximum": 4
        },
        "bit_depth": {
          "enum": [
            8,
            16,
            32
          ]
        },
        "wrap": {
          "enum": [
            "repeat",
            "clamp",
            "mirror"
          ]
        },
        "filter": {
          "enum": [
            "nearest",
            "linear",
            "mipmap"
          ]
        },
        "normal_orientation": {
          "enum": [
            "opengl-positive-y",
            "not-applicable"
          ]
        }
      },
      "required": [
        "schema_version",
        "id",
        "version",
        "dependencies",
        "provenance",
        "validation_status",
        "capabilities",
        "kind",
        "file",
        "role",
        "encoding",
        "width",
        "height",
        "channels",
        "bit_depth",
        "wrap",
        "filter",
        "normal_orientation"
      ]
    },
    "ResourceRef": {
      "type": "object",
      "additionalProperties": false,
      "properties": {
        "id": {
          "type": "string",
          "pattern": "^[A-Za-z0-9][A-Za-z0-9._:-]{0,127}$(?![\\s\\S])"
        },
        "version": {
          "type": "string",
          "pattern": "^(0|[1-9][0-9]*)\\.(0|[1-9][0-9]*)\\.(0|[1-9][0-9]*)$(?![\\s\\S])"
        },
        "path": {
          "type": "string",
          "minLength": 1,
          "maxLength": 4096
        },
        "sha256": {
          "type": "string",
          "pattern": "^[0-9a-f]{64}$(?![\\s\\S])"
        },
        "kind": {
          "enum": [
            "material3d",
            "material-instance3d",
            "material-variant3d",
            "texture3d",
            "material-graph3d",
            "light3d",
            "lighting-rig3d",
            "look3d",
            "render-quality3d"
          ]
        }
      },
      "required": [
        "id",
        "version",
        "path",
        "sha256",
        "kind"
      ]
    }
  },
  "$ref": "#/$defs/texture3d"
}
