{"bit_depth":8,"capabilities":[],"channels":4,"dependencies":[],"encoding":"srgb","file":{"bytes":77,"path":"textures/albedo.png","sha256":"a2965429dce989e992865e2ddfa9e2e1d2d3d113bb3202f532ed47485534726d"},"filter":"linear","height":2,"id":"albedo","kind":"texture3d","normal_orientation":"not-applicable","provenance":{"attribution":"Self-authored engineering fixture","created_at":"2026-10-23T00:00:00Z","license":{"identifier":"CC0-1.0","source":"self-authored"},"origin":"procedural-fixture","source_hashes":[],"tool":"lookdev-contract-tests"},"role":"base-color","schema_version":1,"validation_status":"unvalidated","version":"1.0.0","width":2,"wrap":"repeat"}
